{
  "case_id": "IN-006",
  "title": "Energy drink with caffeine but no CONTAINS CAFFEINE warning",
  "jurisdiction": "IN",
  "product_category": "packaged_food",
  "difficulty": "medium",
  "image": "evaluation/images/IN-006.png",
  "context": {"imported": false, "single_ingredient": false},
  "label_spec": {
    "pack": {
      "px_per_cm": 40,
      "width_cm": 8.0,
      "height_cm": 17.0,
      "principal_panel_area_cm2": 56.0,
      "largest_surface_area_cm2": 136.0,
      "background": "#eef7f3"
    },
    "panels": [
      {
        "id": "front",
        "blocks": [
          {"type": "text", "text": "BOLT ENERGY", "font_px": 32, "bold": true},
          {"type": "text", "text": "Carbonated Energy Drink", "font_px": 22, "bold": true},
          {"type": "symbol", "symbol": "veg_green", "height_px": 26},
          {"type": "text", "text": "Net Vol. 250 ml", "font_px": 18},
          {"type": "text", "text": "MRP Rs. 45 (incl. of all taxes)", "font_px": 14}
        ]
      },
      {
        "id": "back",
        "blocks": [
          {"type": "text", "text": "Ingredients: Carbonated water, Sugar, Citric acid, Caffeine, Taurine, Sodium citrate, Natural flavours, Colour (Caramel INS 150d)", "font_px": 13},
          {"type": "text", "text": "Nutritional Information (per 100 ml): Energy 46 kcal, Protein 0 g, Carbohydrate 11.5 g, Total Sugars 11.5 g, Total Fat 0 g, Sodium 40 mg", "font_px": 13},
          {"type": "text", "text": "Manufactured by: Bolt Beverages Pvt Ltd, 5 Riverside Industrial Park, Baddi 173205, Himachal Pradesh, India", "font_px": 13},
          {"type": "symbol", "symbol": "fssai_logo", "height_px": 26},
          {"type": "text", "text": "Lic. No. 12318776002233", "font_px": 14},
          {"type": "text", "text": "Batch No. BE0810", "font_px": 14},
          {"type": "text", "text": "Date of Manufacture: 05/2026   Use by: 11/2026", "font_px": 14},
          {"type": "text", "text": "Store below 25C, keep away from sunlight", "font_px": 13},
          {"type": "text", "text": "Customer Care: support@boltenergy.example, 1800 220 3344", "font_px": 13}
        ]
      }
    ]
  },
  "notes": "Caffeine is listed as an ingredient (a Schedule II trigger) but no CONTAINS CAFFEINE warning statement is printed anywhere. Isolated single violation of RULE-IN-FOOD-013."
}
