{
  "case_id": "IN-004",
  "title": "Trail mix with multiple simultaneous violations",
  "jurisdiction": "IN",
  "product_category": "packaged_food",
  "difficulty": "medium",
  "image": "evaluation/images/IN-004.png",
  "context": {"imported": false, "single_ingredient": false},
  "label_spec": {
    "pack": {
      "px_per_cm": 40,
      "width_cm": 12.0,
      "height_cm": 17.0,
      "principal_panel_area_cm2": 86.4,
      "largest_surface_area_cm2": 204.0,
      "background": "#f6f3ea"
    },
    "panels": [
      {
        "id": "front",
        "blocks": [
          {"type": "text", "text": "HIGHLAND SNACKS", "font_px": 32, "bold": true},
          {"type": "text", "text": "Mixed Nut Trail Mix", "font_px": 24, "bold": true},
          {"type": "symbol", "symbol": "veg_green", "height_px": 28},
          {"type": "text", "text": "Net Wt. 150 g", "font_px": 18},
          {"type": "text", "text": "MRP Rs. 180 (incl. of all taxes)", "font_px": 14}
        ]
      },
      {
        "id": "back",
        "blocks": [
          {"type": "text", "text": "Ingredients: Cashews (30%), Almonds (25%), Raisins, Roasted chana, Sunflower seeds, Salt", "font_px": 14},
          {"type": "text", "text": "Contains: Cashew nuts, Almonds", "font_px": 14, "bold": true},
          {"type": "text", "text": "Nutritional Information (per 100 g): Energy 560 kcal, Protein 16.0 g, Carbohydrate 38.0 g, Total Sugars 18.0 g, Total Fat 38.0 g, Sodium 190 mg", "font_px": 13},
          {"type": "text", "text": "Manufactured by: Highland Snacks Pvt Ltd, Plot 22, Growth Centre, Shimla 171001, Himachal Pradesh, India", "font_px": 13},
          {"type": "text", "text": "Store in a cool dry place away from direct sunlight", "font_px": 13},
          {"type": "text", "text": "Customer Care: care@highlandsnacks.example, 1800 555 9090", "font_px": 13}
        ]
      }
    ]
  },
  "notes": "Three requirements are simultaneously missing: FSSAI logo and licence number, batch/lot identification, and all date marking. Every other requirement is satisfied."
}
