{
  "case_id": "UK-003",
  "title": "Granola missing food business operator address",
  "jurisdiction": "UK",
  "product_category": "packaged_food",
  "difficulty": "medium",
  "image": "evaluation/images/UK-003.png",
  "context": {"imported": false, "single_ingredient": false},
  "label_spec": {
    "pack": {
      "px_per_cm": 40,
      "width_cm": 11.0,
      "height_cm": 17.0,
      "principal_panel_area_cm2": 80.0,
      "largest_surface_area_cm2": 187.0,
      "background": "#f7f4ea"
    },
    "panels": [
      {
        "id": "front",
        "blocks": [
          {"type": "text", "text": "RIVERSIDE MILLS", "font_px": 32, "bold": true},
          {"type": "text", "text": "Golden Oat Granola", "font_px": 24, "bold": true},
          {"type": "text", "text": "Net weight 400 g", "font_px": 18}
        ]
      },
      {
        "id": "back",
        "blocks": [
          {"type": "text", "text": "Ingredients: OATS (45%), Honey, Sunflower oil, Chopped ALMONDS, Dried cranberries, Cinnamon", "font_px": 14},
          {"type": "text", "text": "Nutrition Information (per 100 g): Energy 470 kcal, Fat 18.0 g of which saturates 3.0 g, Carbohydrate 62.0 g of which sugars 20.0 g, Fibre 7.0 g, Protein 9.0 g, Salt 0.05 g", "font_px": 13},
          {"type": "text", "text": "Best before: 20 AUG 2027", "font_px": 14},
          {"type": "text", "text": "Lot: RM3390", "font_px": 14},
          {"type": "text", "text": "Store in a cool, dry place in an airtight container once opened.", "font_px": 13}
        ]
      }
    ]
  },
  "notes": "The front panel brand name Riverside Mills is decorative only. No formal food business operator name and address block appears anywhere on the pack. Isolated single violation."
}
