{
  "case_id": "IN-005",
  "title": "Pickle jar with no ingredients list at all",
  "jurisdiction": "IN",
  "product_category": "packaged_food",
  "difficulty": "easy",
  "image": "evaluation/images/IN-005.png",
  "context": {"imported": false, "single_ingredient": false},
  "label_spec": {
    "pack": {
      "px_per_cm": 40,
      "width_cm": 9.0,
      "height_cm": 16.0,
      "principal_panel_area_cm2": 64.0,
      "largest_surface_area_cm2": 144.0,
      "background": "#fbf5e9"
    },
    "panels": [
      {
        "id": "front",
        "blocks": [
          {"type": "text", "text": "MOTHER'S KITCHEN", "font_px": 30, "bold": true},
          {"type": "text", "text": "Mango Pickle", "font_px": 24, "bold": true},
          {"type": "symbol", "symbol": "nonveg_brown", "height_px": 26},
          {"type": "text", "text": "Net Wt. 400 g", "font_px": 18},
          {"type": "text", "text": "MRP Rs. 120 (incl. of all taxes)", "font_px": 14}
        ]
      },
      {
        "id": "back",
        "blocks": [
          {"type": "text", "text": "Nutritional Information (per 100 g): Energy 210 kcal, Protein 2.0 g, Carbohydrate 12.0 g, Total Sugars 4.0 g, Total Fat 17.0 g, Sodium 1450 mg", "font_px": 13},
          {"type": "text", "text": "Manufactured by: Mother's Kitchen Foods Pvt Ltd, 7 Market Yard Road, Nagpur 440001, Maharashtra, India", "font_px": 13},
          {"type": "symbol", "symbol": "fssai_logo", "height_px": 26},
          {"type": "text", "text": "Lic. No. 21419002001987", "font_px": 14},
          {"type": "text", "text": "Batch No. MK0552", "font_px": 14},
          {"type": "text", "text": "Date of Manufacture: 03/2026   Use by: 03/2027", "font_px": 14},
          {"type": "text", "text": "Store in a cool dry place, use a dry spoon", "font_px": 13},
          {"type": "text", "text": "Customer Care: care@motherskitchen.example, 1800 400 1122", "font_px": 13}
        ]
      }
    ]
  },
  "notes": "No ingredients declaration appears anywhere on the label, front or back. Isolated single violation of RULE-IN-FOOD-002. This is a non-vegetarian marked product (mustard oil based pickle sometimes contains fish/shrimp paste in some regions; here marked non-veg to exercise the brown symbol path) but no allergen keywords are present so the allergen rule stays not applicable."
}
