{
  "case_id": "UK-004",
  "title": "Sugar-free squash with aspartame but no phenylalanine warning",
  "jurisdiction": "UK",
  "product_category": "packaged_food",
  "difficulty": "medium",
  "image": "evaluation/images/UK-004.png",
  "context": {"imported": false, "single_ingredient": false},
  "label_spec": {
    "pack": {
      "px_per_cm": 40,
      "width_cm": 9.0,
      "height_cm": 17.0,
      "principal_panel_area_cm2": 64.0,
      "largest_surface_area_cm2": 153.0,
      "background": "#f0f7fb"
    },
    "panels": [
      {
        "id": "front",
        "blocks": [
          {"type": "text", "text": "BRIGHTON SQUASH", "font_px": 30, "bold": true},
          {"type": "text", "text": "Sugar-Free Orange Squash", "font_px": 22, "bold": true},
          {"type": "text", "text": "Net volume 750 ml", "font_px": 16}
        ]
      },
      {
        "id": "back",
        "blocks": [
          {"type": "text", "text": "Ingredients: Water, Citric acid, Orange juice from concentrate (5%), ASPARTAME (E951), Natural orange flavouring, Preservative (potassium sorbate)", "font_px": 13},
          {"type": "text", "text": "Nutrition Information (per 100 ml): Energy 4 kcal, Fat 0.0 g, Carbohydrate 0.9 g of which sugars 0.9 g, Fibre 0.0 g, Protein 0.0 g, Salt 0.01 g", "font_px": 13},
          {"type": "text", "text": "Made in the UK for Brighton Beverages Ltd, 14 Harbour View, Brighton, BN1 2AA, United Kingdom", "font_px": 13},
          {"type": "text", "text": "Best before: 10 JUN 2027", "font_px": 14},
          {"type": "text", "text": "Lot: BB5521", "font_px": 14},
          {"type": "text", "text": "Store in a cool place out of direct sunlight. Refrigerate after opening.", "font_px": 13}
        ]
      }
    ]
  },
  "notes": "Aspartame is capitalised and listed with its E number, satisfying the allergen emphasis style used elsewhere in this rule pack, but aspartame is not an allergen, it is a sweetener that triggers a separate mandatory warning statement about phenylalanine which does not appear anywhere on the label. Isolated single violation of RULE-UK-FOOD-012."
}
