{
  "case_id": "UK-006",
  "title": "Fully compliant oat cracker label, photographed at a slight angle with light blur and noise",
  "jurisdiction": "UK",
  "product_category": "packaged_food",
  "difficulty": "hard",
  "image": "evaluation/images/UK-006.png",
  "context": {"imported": false, "single_ingredient": false},
  "label_spec": {
    "pack": {
      "px_per_cm": 40,
      "width_cm": 10.0,
      "height_cm": 17.0,
      "principal_panel_area_cm2": 72.0,
      "largest_surface_area_cm2": 170.0,
      "background": "#f6f1e6",
      "rotation_degrees": 4,
      "blur_radius": 1.1,
      "noise": 0.004
    },
    "panels": [
      {
        "id": "front",
        "blocks": [
          {"type": "text", "text": "MEADOWSIDE", "font_px": 30, "bold": true},
          {"type": "text", "text": "Herby Oat Crackers", "font_px": 22, "bold": true},
          {"type": "text", "text": "Net weight 200 g", "font_px": 16}
        ]
      },
      {
        "id": "back",
        "blocks": [
          {"type": "text", "text": "Ingredients: OATS (40%), Sunflower oil, Salt, Mixed herbs (rosemary, thyme), Raising agent (sodium bicarbonate)", "font_px": 14},
          {"type": "text", "text": "Nutrition Information (per 100 g): Energy 470 kcal, Fat 22.0 g of which saturates 2.5 g, Carbohydrate 58.0 g of which sugars 1.0 g, Fibre 6.0 g, Protein 9.0 g, Salt 1.1 g", "font_px": 13},
          {"type": "text", "text": "Made in the UK for Meadowside Bakery Ltd, 9 Orchard Row, Bristol, BS1 4DE, United Kingdom", "font_px": 13},
          {"type": "text", "text": "Best before: 05 SEP 2027", "font_px": 14},
          {"type": "text", "text": "Lot: MB7743", "font_px": 14},
          {"type": "text", "text": "Store in a cool, dry place. Re-crisp in a low oven if needed.", "font_px": 13}
        ]
      }
    ]
  },
  "notes": "Every requirement is genuinely satisfied. The rendering applies a 4 degree rotation, a light Gaussian blur and light pixel noise to simulate a real photograph taken at an angle under imperfect conditions, testing extraction robustness rather than compliance logic."
}
